{
   "title": "Actor Types",
   "version": "1.0",
   "actors": [
      {
         "name": "User Interface",
         "alias": "UI",
         "actorType": "participant"
      },
      {
         "name": "Human User",
         "alias": "User",
         "actorType": "actor",
         "bgColour": "rgb(255,232,204)"
      },
      {
         "name": "API Gateway",
         "alias": "API",
         "actorType": "boundary",
         "bgColour": "rgb(196,232,255)"
      },
      {
         "name": "Service Controller",
         "alias": "Svc",
         "actorType": "control",
         "bgColour": "rgb(255,244,179)"
      },
      {
         "name": "Data Model",
         "alias": "Data",
         "actorType": "entity",
         "bgColour": "rgb(220,255,214)"
      },
      {
         "name": "Database",
         "alias": "DB",
         "actorType": "database",
         "bgColour": "rgb(255,221,234)"
      },
      {
         "name": "Item Collection",
         "alias": "Items",
         "actorType": "collections",
         "bgColour": "rgb(226,220,255)"
      },
      {
         "name": "Job Queue",
         "alias": "Jobs",
         "actorType": "queue",
         "bgColour": "rgb(255,235,186)"
      }
   ],
   "lines": []
}