{
   "title": "Notes",
   "version": "1.0",
   "actors": [
      {
         "name": "A",
         "alias": "A",
         "actorType": "participant"
      },
      {
         "name": "B",
         "alias": "B",
         "actorType": "participant"
      }
   ],
   "lines": [
      {
         "type": "blank",
         "height": 0,
         "comment": "Single actor note",
         "actor": "A"
      },
      {
         "type": "blank",
         "height": 0,
         "comment": "Spanning note",
         "actors": [
            "A",
            "B"
         ]
      },
      {
         "type": "blank",
         "height": 0,
         "comment": "Right-side note",
         "actor": "A"
      },
      {
         "type": "blank",
         "height": 0,
         "comment": "Left-side note",
         "actor": "B"
      },
      {
         "type": "call",
         "from": "A",
         "to": "B",
         "text": "Call with attached note",
         "toArrow": "fill",
         "arrow": "fill",
         "comment": "Attached note rule: Note over A,B immediately before an A to B message becomes that message's sequencer comment"
      }
   ]
}